{
  "schemaVersion": 1,
  "id": "customer-info",
  "name": "客户信息（2行×4列）",
  "rows": 2,
  "cols": 4,
  "defaultStyle": {
    "fontFamily": "Arial",
    "fontSizePt": 11,
    "vertical": "middle",
    "wrap": true,
    "borders": {
      "top": {
        "style": "thin",
        "color": "#CBD5E1"
      },
      "right": {
        "style": "thin",
        "color": "#CBD5E1"
      },
      "bottom": {
        "style": "thin",
        "color": "#CBD5E1"
      },
      "left": {
        "style": "thin",
        "color": "#CBD5E1"
      }
    }
  },
  "merges": [],
  "cells": [
    {
      "r": 0,
      "c": 0,
      "text": "客户名称",
      "style": {
        "background": "#EEF2F6",
        "bold": true
      }
    },
    {
      "r": 0,
      "c": 1,
      "binding": {
        "path": "customer.name",
        "format": "text"
      }
    },
    {
      "r": 0,
      "c": 2,
      "text": "订单号",
      "style": {
        "background": "#EEF2F6",
        "bold": true
      }
    },
    {
      "r": 0,
      "c": 3,
      "binding": {
        "path": "orderNo",
        "format": "text"
      }
    },
    {
      "r": 1,
      "c": 0,
      "text": "联系人",
      "style": {
        "background": "#EEF2F6",
        "bold": true
      }
    },
    {
      "r": 1,
      "c": 1,
      "binding": {
        "path": "customer.contact",
        "format": "text"
      }
    },
    {
      "r": 1,
      "c": 2,
      "text": "联系电话",
      "style": {
        "background": "#EEF2F6",
        "bold": true
      }
    },
    {
      "r": 1,
      "c": 3,
      "binding": {
        "path": "customer.phone",
        "format": "text"
      }
    }
  ]
}
